{
  "policy_format_version": "0.1.0",
  "repository_kind": "application",
  "paths": {
    "forbidden": [],
    "canonical_docs": ["README.md"],
    "governance_paths": ["repo-policy.json"]
  },
  "diff_rules": {
    "max_new_docs": 5,
    "max_new_files": 30
  },
  "content_rules": [],
  "cochange_rules": []
}
