{
  "policy_format_version": "0.1.0",
  "repository_kind": "library",
  "paths": {
    "forbidden": ["*.bak"],
    "canonical_docs": ["README.md"],
    "governance_paths": ["repo-policy.json"]
  },
  "diff_rules": {
    "max_new_docs": 3,
    "max_new_files": 20
  },
  "content_rules": [],
  "cochange_rules": []
}
